1,Egestas Aliquam PC,Egestas,1331 Nec St.,ullamcorper magna.
2,Ut Tincidunt Orci LLP,Tincidunt Orci,441-1114 Risus. Ave,"at, nisi."
3,A Aliquet Inc.,Aliquet,Ap #371-6139 Hendrerit Street,felis purus ac tellus. Suspendisse sed
4,Nec Metus Facilisis Foundation,Metus Facilisis,Ap #537-7038 Nisi Avenue,"mi enim, condimentum"
5,Lacus Ut Inc.,Lacus,262-9248 Erat Rd.,"sapien. Cras dolor dolor,"
6,Ridiculus LLP,Ridiculus,"150-2020 Sed, Street",ut nisi a odio semper cursus.
7,Luctus Ltd,Luctus,Ap #652-6437 Sed Rd.,Fusce dolor
8,Amet Limited,Amet,"Ap #256-2679 Aliquet, Road",In nec orci. Donec nibh. Quisque nonummy ipsum non
9,Ut Pharetra Corp.,Pharetra,7321 Malesuada. Rd.,"viverra. Donec tempus, lorem fringilla ornare placerat,"
10,Pellentesque Ultricies Incorporated,Pellentesque Ultricies,"P.O. Box 120, 3887 Dui Street","conubia nostra, per inceptos hymenaeos. Mauris ut quam"
